{
  "symbol": "KDH",
  "observations": [
    {
      "symbol": "KDH",
      "period_end": "2023-08-31",
      "period_type": "quarter",
      "statement_type": "income_statement",
      "metric_code": "revenue",
      "metric_label_vi": "Doanh thu thuan",
      "value": 11949.93,
      "currency": "VND",
      "unit": "billion_vnd",
      "consolidated": true,
      "restatement_version": 1,
      "publication_date": "2023-09-24",
      "source_url": "https://vnstock.example/placeholder",
      "ingested_at": "2026-07-30T21:30:00+07:00"
    },
    {
      "symbol": "KDH",
      "period_end": "2023-08-31",
      "period_type": "quarter",
      "statement_type": "income_statement",
      "metric_code": "net_income",
      "metric_label_vi": "Loi nhuan sau thue",
      "value": 1220.02,
      "currency": "VND",
      "unit": "billion_vnd",
      "consolidated": true,
      "restatement_version": 1,
      "publication_date": "2023-09-24",
      "source_url": "https://vnstock.example/placeholder",
      "ingested_at": "2026-07-30T21:30:00+07:00"
    },
    {
      "symbol": "KDH",
      "period_end": "2023-11-30",
      "period_type": "quarter",
      "statement_type": "income_statement",
      "metric_code": "revenue",
      "metric_label_vi": "Doanh thu thuan",
      "value": 11889.83,
      "currency": "VND",
      "unit": "billion_vnd",
      "consolidated": true,
      "restatement_version": 1,
      "publication_date": "2024-01-07",
      "source_url": "https://vnstock.example/placeholder",
      "ingested_at": "2026-07-30T21:30:00+07:00"
    },
    {
      "symbol": "KDH",
      "period_end": "2023-11-30",
      "period_type": "quarter",
      "statement_type": "income_statement",
      "metric_code": "net_income",
      "metric_label_vi": "Loi nhuan sau thue",
      "value": 1102.19,
      "currency": "VND",
      "unit": "billion_vnd",
      "consolidated": true,
      "restatement_version": 1,
      "publication_date": "2024-01-07",
      "source_url": "https://vnstock.example/placeholder",
      "ingested_at": "2026-07-30T21:30:00+07:00"
    },
    {
      "symbol": "KDH",
      "period_end": "2024-02-29",
      "period_type": "quarter",
      "statement_type": "income_statement",
      "metric_code": "revenue",
      "metric_label_vi": "Doanh thu thuan",
      "value": 12197.79,
      "currency": "VND",
      "unit": "billion_vnd",
      "consolidated": true,
      "restatement_version": 1,
      "publication_date": "2024-04-02",
      "source_url": "https://vnstock.example/placeholder",
      "ingested_at": "2026-07-30T21:30:00+07:00"
    },
    {
      "symbol": "KDH",
      "period_end": "2024-02-29",
      "period_type": "quarter",
      "statement_type": "income_statement",
      "metric_code": "net_income",
      "metric_label_vi": "Loi nhuan sau thue",
      "value": 1838.54,
      "currency": "VND",
      "unit": "billion_vnd",
      "consolidated": true,
      "restatement_version": 1,
      "publication_date": "2024-04-02",
      "source_url": "https://vnstock.example/placeholder",
      "ingested_at": "2026-07-30T21:30:00+07:00"
    },
    {
      "symbol": "KDH",
      "period_end": "2024-05-31",
      "period_type": "quarter",
      "statement_type": "income_statement",
      "metric_code": "revenue",
      "metric_label_vi": "Doanh thu thuan",
      "value": 12391.86,
      "currency": "VND",
      "unit": "billion_vnd",
      "consolidated": true,
      "restatement_version": 1,
      "publication_date": "2024-06-21",
      "source_url": "https://vnstock.example/placeholder",
      "ingested_at": "2026-07-30T21:30:00+07:00"
    },
    {
      "symbol": "KDH",
      "period_end": "2024-05-31",
      "period_type": "quarter",
      "statement_type": "income_statement",
      "metric_code": "net_income",
      "metric_label_vi": "Loi nhuan sau thue",
      "value": 1291.27,
      "currency": "VND",
      "unit": "billion_vnd",
      "consolidated": true,
      "restatement_version": 1,
      "publication_date": "2024-06-21",
      "source_url": "https://vnstock.example/placeholder",
      "ingested_at": "2026-07-30T21:30:00+07:00"
    },
    {
      "symbol": "KDH",
      "period_end": "2024-08-31",
      "period_type": "quarter",
      "statement_type": "income_statement",
      "metric_code": "revenue",
      "metric_label_vi": "Doanh thu thuan",
      "value": 12489.73,
      "currency": "VND",
      "unit": "billion_vnd",
      "consolidated": true,
      "restatement_version": 1,
      "publication_date": "2024-09-24",
      "source_url": "https://vnstock.example/placeholder",
      "ingested_at": "2026-07-30T21:30:00+07:00"
    },
    {
      "symbol": "KDH",
      "period_end": "2024-08-31",
      "period_type": "quarter",
      "statement_type": "income_statement",
      "metric_code": "net_income",
      "metric_label_vi": "Loi nhuan sau thue",
      "value": 1705.1,
      "currency": "VND",
      "unit": "billion_vnd",
      "consolidated": true,
      "restatement_version": 1,
      "publication_date": "2024-09-24",
      "source_url": "https://vnstock.example/placeholder",
      "ingested_at": "2026-07-30T21:30:00+07:00"
    },
    {
      "symbol": "KDH",
      "period_end": "2024-11-30",
      "period_type": "quarter",
      "statement_type": "income_statement",
      "metric_code": "revenue",
      "metric_label_vi": "Doanh thu thuan",
      "value": 12965.78,
      "currency": "VND",
      "unit": "billion_vnd",
      "consolidated": true,
      "restatement_version": 1,
      "publication_date": "2025-01-03",
      "source_url": "https://vnstock.example/placeholder",
      "ingested_at": "2026-07-30T21:30:00+07:00"
    },
    {
      "symbol": "KDH",
      "period_end": "2024-11-30",
      "period_type": "quarter",
      "statement_type": "income_statement",
      "metric_code": "net_income",
      "metric_label_vi": "Loi nhuan sau thue",
      "value": 1247.97,
      "currency": "VND",
      "unit": "billion_vnd",
      "consolidated": true,
      "restatement_version": 1,
      "publication_date": "2025-01-03",
      "source_url": "https://vnstock.example/placeholder",
      "ingested_at": "2026-07-30T21:30:00+07:00"
    },
    {
      "symbol": "KDH",
      "period_end": "2024-11-30",
      "period_type": "quarter",
      "statement_type": "income_statement",
      "metric_code": "revenue",
      "metric_label_vi": "Doanh thu thuan",
      "value": 13455.68,
      "currency": "VND",
      "unit": "billion_vnd",
      "consolidated": true,
      "restatement_version": 1,
      "publication_date": "2025-01-09",
      "source_url": "https://vnstock.example/placeholder",
      "ingested_at": "2026-07-30T21:30:00+07:00"
    },
    {
      "symbol": "KDH",
      "period_end": "2024-11-30",
      "period_type": "quarter",
      "statement_type": "income_statement",
      "metric_code": "net_income",
      "metric_label_vi": "Loi nhuan sau thue",
      "value": 2128.77,
      "currency": "VND",
      "unit": "billion_vnd",
      "consolidated": true,
      "restatement_version": 1,
      "publication_date": "2025-01-09",
      "source_url": "https://vnstock.example/placeholder",
      "ingested_at": "2026-07-30T21:30:00+07:00"
    },
    {
      "symbol": "KDH",
      "period_end": "2025-05-31",
      "period_type": "quarter",
      "statement_type": "income_statement",
      "metric_code": "revenue",
      "metric_label_vi": "Doanh thu thuan",
      "value": 13392.23,
      "currency": "VND",
      "unit": "billion_vnd",
      "consolidated": true,
      "restatement_version": 1,
      "publication_date": "2025-07-06",
      "source_url": "https://vnstock.example/placeholder",
      "ingested_at": "2026-07-30T21:30:00+07:00"
    },
    {
      "symbol": "KDH",
      "period_end": "2025-05-31",
      "period_type": "quarter",
      "statement_type": "income_statement",
      "metric_code": "net_income",
      "metric_label_vi": "Loi nhuan sau thue",
      "value": 2277.32,
      "currency": "VND",
      "unit": "billion_vnd",
      "consolidated": true,
      "restatement_version": 1,
      "publication_date": "2025-07-06",
      "source_url": "https://vnstock.example/placeholder",
      "ingested_at": "2026-07-30T21:30:00+07:00"
    },
    {
      "symbol": "KDH",
      "period_end": "2025-08-31",
      "period_type": "quarter",
      "statement_type": "income_statement",
      "metric_code": "revenue",
      "metric_label_vi": "Doanh thu thuan",
      "value": 14121.05,
      "currency": "VND",
      "unit": "billion_vnd",
      "consolidated": true,
      "restatement_version": 1,
      "publication_date": "2025-10-04",
      "source_url": "https://vnstock.example/placeholder",
      "ingested_at": "2026-07-30T21:30:00+07:00"
    },
    {
      "symbol": "KDH",
      "period_end": "2025-08-31",
      "period_type": "quarter",
      "statement_type": "income_statement",
      "metric_code": "net_income",
      "metric_label_vi": "Loi nhuan sau thue",
      "value": 2053.87,
      "currency": "VND",
      "unit": "billion_vnd",
      "consolidated": true,
      "restatement_version": 1,
      "publication_date": "2025-10-04",
      "source_url": "https://vnstock.example/placeholder",
      "ingested_at": "2026-07-30T21:30:00+07:00"
    },
    {
      "symbol": "KDH",
      "period_end": "2025-08-31",
      "period_type": "quarter",
      "statement_type": "income_statement",
      "metric_code": "revenue",
      "metric_label_vi": "Doanh thu thuan",
      "value": 14488.28,
      "currency": "VND",
      "unit": "billion_vnd",
      "consolidated": true,
      "restatement_version": 1,
      "publication_date": null,
      "source_url": "https://vnstock.example/placeholder",
      "ingested_at": "2026-07-30T21:30:00+07:00"
    },
    {
      "symbol": "KDH",
      "period_end": "2025-08-31",
      "period_type": "quarter",
      "statement_type": "income_statement",
      "metric_code": "net_income",
      "metric_label_vi": "Loi nhuan sau thue",
      "value": 2173.51,